title,description,userState,userCity,status,created,url
Falha multimídia VW Play Polo,"Adquirimos um veículo Polo Highline 2025/2026 a 70 dias, encontra-se com 8000km, e desde a primeira semana de uso apresenta falhas no funcionamento da multimídia através do Android Auto sem fio, a mídia chega a conectar-se sem fio, mas cai a conexão repetidas vezes, onde voce tem que desligar o veículo, abrir e fechar a porta do motorista, ligar o veículo novamente para poder conectar-se novamente, mas infelizmente a falha se repete à todo momento, além de demorar demasiadamente para inicializar as operações ao ligar o veículo.<br /><br />Levei o veículo na concessionária Balila Volkswagen de Indaiatuba, para o reparo dos problemas, deixei o automóvel um dia inteiro para um feedback negativo. Que não havia nenhum problema com o aparelho. Lamentável colocar em dúvida a palavra do proprietário do veículo, com qual intuito perderia um dia de trabalho para deixar o veículo na concessionária se não houvesse problemas. Fui a outra concessionária do interior de São Paulo, e o próprio funcionário da unidade relatou que não há solução definitiva para esse tipo de falha protocolada no momento, uma vez que meu aparelho já estava atualizado com a última versão. <br /><br />Agora, comprar uma veículo zero km, valor superior a R$ 130.000,00 e ter um problema onde a indústria não resolve uma falha operacional? LAMENTÁVEL.",SP,Indaiatuba,PENDING,2025-10-16T14:30:52,https://www.reclameaqui.com.br/volkswagen/falha-multimidia-vw-play-polo_hM6feP7AAV_zM5fC/
"Carro 0km com defeito no freio e ar-condicionado, demora na liberação do carro reserva","Comprei um carro 0km, nos primeiros 20 dias de uso apresentou defeito no freio e ar-condicionado, já foi para oficina da Bhemem 2 vezes, nessa segunda vez a VW disse q eu tinha direito a um carro reserva, abri um protocolo já faz mais de 48h e ninguém entrou em contato comigo para liberação desse carro. Depois da abertura do protocolo(após48h), já entrei em contato duas vezes e ninguém sabe de nada.<br /><br /><br />Protocolo aberto - *****<br /><br />Obs: já estou a 72h sem o meu carro, que é 0km, sem nenhum diagnóstico preciso.",PE,Recife,PENDING,2025-10-16T14:09:06,https://www.reclameaqui.com.br/volkswagen/carro-0km-com-defeito-no-freio-e-ar-condicionado-demora-na-liberacao-do-carro-reserva_QXQjMTIMCv0qOqoc/
Calor intenso nas pernas do motorista e passageiro  T-Cross 2024,"Calor intenso nas pernas do motorista e passageiro  T-Cross 2024<br /><br />Comprei meu T-Cross 2024 zero quilômetro e, desde os primeiros meses, percebo um calor excessivo vindo do motor e das saídas de ar, principalmente nas pernas do motorista e passageiro.<br /><br />Já relatei o problema em todas as revisões, e a concessionária apenas faz ajustes temporários. O desconforto volta em poucos dias. Recentemente, fui informada de que o calor vem da mangueira do radiador de ar quente, e que esse sistema é o mesmo usado em outros modelos (Nivus, Virtus e Polo).<br /><br />Fiquei indignada com a explicação, pois andar com o ar-condicionado ligado o tempo todo não é normal em um carro desse nível. Se for realmente um erro de projeto, trata-se de uma falha grave que compromete o conforto e a satisfação do cliente.<br /><br />Peço uma solução definitiva e não paliativa, pois o problema é recorrente e afeta diretamente o uso do veículo.",SP,Sorocaba,ANSWERED,2025-10-16T14:04:31,https://www.reclameaqui.com.br/volkswagen/calor-intenso-nas-pernas-do-motorista-e-passageiro-t-cross-2024_tO91VQSqq64e7s8W/
Volante de Tcross 2024 descamando com 27000 km e negativa da montadora para troca,"Eu tenho um Tcross 2024, Highline, com 27000 km rodados, e o volante está descamando na parte de cima. Acioniei a concessionária Original VW de Arujá, ela reportou que a montadora informa que foram agentes externos que causaram o desgaste, mas é o meu segundo carro, e o primeiro tive por mais tempo e não ocorreu nenhum problema. O carro foi comprado em Abril de 2024, e já está com esse problema. Isso é bem decepcionante, até porque a atendente disse que não há o que fazer quando é reportado pela montadora que não fará a troca.<br />Um volante novo custa em média R$ 1700,00, fora o custo pra troca.",SP,Arujá,PENDING,2025-10-16T13:52:38,https://www.reclameaqui.com.br/volkswagen/volante-de-tcross-2024-descamando-com-27000-km-e-negativa-da-montadora-para-troca_YUHUUzmvr9-5c6PI/
Reclamação Qualidade do tapete e falta de suporte no atendimento,"Prezados,<br /><br />Venho por meio deste manifestar minha insatisfação em relação à qualidade do tapete original do meu veículo Volkswagen, que apresentou desgaste excessivo em apenas 10 meses de uso, chegando a furar e danificar o carpete do carro.<br /><br />Além do problema de qualidade do material, destaco também a falta de apoio por parte da Volkswagen nos canais de atendimento, uma vez que não obtive retorno ou solução efetiva ao relatar a situação.<br /><br />Considerando que o veículo é recente e que o tapete faz parte dos itens de acabamento interno, entendo que não é razoável um desgaste tão rápido, ainda mais em um produto que leva o nome da marca e deveria prezar pela durabilidade e qualidade.<br /><br />Dessa forma, sinto-me prejudicado, pois serei obrigado a adquirir um novo jogo de tapetes por conta própria, arcando com um custo que não deveria existir. Solicito, portanto, uma solução adequada ou a substituição do item, a fim de evitar maior prejuízo e garantir o respeito ao consumidor.<br /><br />Aguardo um posicionamento da Volkswagen.",RJ,Belford Roxo,ANSWERED,2025-10-16T12:46:24,https://www.reclameaqui.com.br/volkswagen/reclamacao-qualidade-do-tapete-e-falta-de-suporte-no-atendimento_BrXiPcDvixNv_PO7/
Recall não retirado do sistema após prazo e falta de suporte da concessionária,"No dia 12/09/2025 realizei um recall na concessionária TABO Veículos na cidade de Mococa - SP, me deram o prazo de 30 dias corridos para o recall sair do sistema, porém, hoje dia 16/10 o recall ainda consta no sistema, entrei em contato com a concessionária no dia 13/10 para saber o motivo e fui informado que o problema seria no DETRAN, fui até o DETRAN na mesma data e me deram um comprovante de que a comunicação do recall ainda não havia sido feita por parte da Volkswagen, entrei novamente em contato com a concessionária Tabo e fui informado que não podem fazer nada para me ajudar, que a parte deles estava feita e que eu deveria entrar em contato com o ***** da vw, depois de muitas tentativas consegui que abrissem um chamado para resolver meu caso, chamado N ***** e me pediram 1 dia útil para resolver e entrariam em contato, esperei porém não tive nenhum retorno, entrei contato novamente e me pediram mais 1 dia útil para resolver e até o momento nenhuma notícia o veículo está vendido e o comprador me pressionando para regularizar a transferência",SP,São João da Boa Vista,ANSWERED,2025-10-16T12:42:49,https://www.reclameaqui.com.br/volkswagen/recall-nao-retirado-do-sistema-apos-prazo-e-falta-de-suporte-da-concessionaria_HTgm4ouqx-r8fDYR/
Falta de Peça de Reposição (Para-choque) para Veículo Volkswagen,"Sofri uma colisão na traseira do meu veículo onde necessito a substituição completa do parachoque. A volkswagem simplesmente informa que a peça não tem.disponivel e que não tem previsão para produzir pq a peça está em B.O, nem sei o que significa. <br />É um [Editado pelo Reclame Aqui] a gente comprar um carro de 160 mil reais em 2025 e não ter um parachoque de reposição. <br /><br />Espero que essa reclamação surta algum efeito porque eu vou acionar pequenas causas. <br /><br />#não comprem volkswagem",SP,São Paulo,PENDING,2025-10-16T12:10:36,https://www.reclameaqui.com.br/volkswagen/falta-de-peca-de-reposicao-para-choque-para-veiculo-volkswagen_Z5m7OdLTOVVMFdvi/
Solicitação de reembolso negada para despesas de transporte durante recall de veículo VW Up Move 2016 e número 0800 da empresa não funciona.,"Levei meu carro, um Up Move modelo 2016, a uma concessionária VW para um recall. Sei que, de acordo com o Código de Defesa do Consumidor, a empresa é responsável por qualquer gasto relacionado ao recall, que, obviamente, não é responsabilidade do consumidor. Questionei na concessionária sobre reembolso dos valores gastos com os carros de aplicativo que tive que pegar para deixar o carro para o recall e depois para buscá-lo. A concessionária informou que esta não era uma prática da Volkswagen e que eu deveria ligar para um número ***** que me forneceram para tentar esclarecer. Contudo, o número fornecido não funciona. <br />O meu pedido foi simples e justo; requisitei apenas os valores gastos para ir e voltar do local do recall. Poderia, por lei, ter pedido também os valores gastos com transporte para outros locais que precisei ir enquanto estava sem o carro. Mas nem isso a VW se prestou a fazer.",RJ,Niterói,ANSWERED,2025-10-16T11:54:59,https://www.reclameaqui.com.br/volkswagen/solicitacao-de-reembolso-negada-para-despesas-de-transporte-durante-recall-de-veiculo-vw-up-move-2016-e-numero-0800-da-empresa-nao-funciona_S3s9O5WSG-q4Xz_3/
Volkswagen e concessionária não solucionam pane em Taos há mais de um mês e não oferecem carro reserva,"Comprei um Volkswagen Taos que ainda está na garantia de fábrica. No dia 9 de setembro de 2025, o carro deu uma pane elétrica/mecânica completa e parou no meio de uma avenida, me deixando em situação de risco. No dia 10 de setembro, o veículo foi levado de guincho para a concessionária autorizada, onde está até hoje.<br /><br />Desde então, estou sem carro há mais de um mês, sem qualquer previsão de solução. O atendimento da concessionária e da própria Volkswagen tem sido péssimo. Já abri protocolo no SAC da Volkswagen no dia 2 de outubro, e me foi informado que eu teria direito a um carro reserva. Porém, o técnico que abriu o protocolo nunca mais entrou em contato, mesmo dizendo que retornaria no dia seguinte.<br /><br />Desde então, ninguém me liga, ninguém dá retorno, e cada vez que tento contato, dizem apenas que vão pedir para retornarem  o que nunca acontece. Não recebo informações sobre o andamento do reparo, nem sobre o carro reserva.<br /><br />Estou muito frustrada e me sentindo completamente desamparada. Trata-se de um carro praticamente novo, com apenas 18 mil km rodados, e é inaceitável uma demora dessas sem suporte ao cliente.<br /><br />Além do transtorno, estou tendo prejuízos financeiros com deslocamentos diários de Uber e a ausência de um carro reserva prometido. Solicito urgência na solução do problema, posicionamento claro sobre o reparo e o carro reserva, e compensação pelos danos causados.",RS,Porto Alegre,PENDING,2025-10-16T11:27:24,https://www.reclameaqui.com.br/volkswagen/volkswagen-e-concessionaria-nao-solucionam-pane-em-taos-ha-mais-de-um-mes-e-nao-oferecem-carro-reserva_9r3DyrW0z5Zx8ds5/
Demora na entrega de peça de reposição (parachoque) para veículo zero km - PEÇA EM &quot;BO&quot;,"Adquiri meu carro zero km há aproximadamente 2 meses, e sofri um acidente de trânsito no qual um motoqueiro atingiu meu parachoque traseiro. A oficina solicitou as peças à Vecol de Piracicaba desde 04/09/2025, o que está registrado com pedido sob n ***** junto à Fábrica Volkswagen. Segundo a concessionária Vecol, a peça está em &quot;BO&quot;, ou seja, indisponível e sem previsão de entrega (parachoque - código 6ec807417fgru). A mesma informação foi confirmada também pelo grupo Maggi. <br />Nem é preciso dizer o meu grau de insatisfação com a incompetência logística da Volkswagen, que coloca um carro novo no mercado e não mantém estoque mínimo de peças para atender seus clientes.  Estou literalmente com o carro há mais tempo batido do que novo, e não pude nem curtir a experiência do carro zero km.<br />Espero ter solução em breve, e não precisar acioná-los judicialmente para a solução do problema.<br />À parte disso, apesar dos muitos anos como cliente da marca, irei reconsiderar minha preferência pela marca na minha próxima troca de veículo.",SP,Piracicaba,PENDING,2025-10-16T11:02:16,https://www.reclameaqui.com.br/volkswagen/demora-na-entrega-de-peca-de-reposicao-parachoque-para-veiculo-zero-km-peca-em-bo_8vChFqTyIOUjbE_k/
Demora excessiva na entrega de farol para VW Taos Highline 2024 após colisão.,"Sou proprietário de um veículo VW TAOS HIGHLINE 2024. Eu o adquiri 0km. Tive uma colisão com meu veículo, acionei meu seguro. Todas as peças já chegaram porém não tem o farol dianteiro esquerdo em nenhuma concessionária. O pedido da peça junto a VW foi feito dia 10/09/2025 e estou há 36 dias sem meu carro, pois o mesmo está imobilizado. Já fiz uma reclamação na fábrica VW porém não a diantou nada. Continuo a espera, sem solução.",SP,Sorocaba,ANSWERED,2025-10-16T10:29:53,https://www.reclameaqui.com.br/volkswagen/demora-excessiva-na-entrega-de-farol-para-vw-taos-highline-2024-apos-colisao_XxGxzVhvX6Qu8aFk/
Atraso na entrega de veículo VW Polo PCD e falta de transparência no processo de compra,"Adquiri um veículo VW Polo Sense 2026 (venda direta PCD) em 02/08/2025, conforme pedido n *****, na concessionária Coletto 3R Comércio e Serviços Automotivos Ltda, em Ourinhos/SP.<br />Na ocasião, recebi a informação verbal de que o faturamento e a entrega ocorreriam em aproximadamente 45 dias.<br /><br />Desde o início mantive contato frequente com a vendedora, que em mensagens de 04/08, 11/08 e 14/08 informou que o pedido já havia sido passado e acatado pela fábrica, mencionando inclusive que havia veículos disponíveis sem roda de liga leve, e que o meu modelo seria com roda de liga  o que indicava que o pedido já estava em andamento.<br /><br />Diante do atraso em relação à data inicialmente informada, da ausência de previsão concreta de faturamento e entrega, e da justificativa repetida apenas sobre a roda de liga leve, entrei em contato diretamente com a VW em 07/10/2025 (protocolo *****).<br /><br />Para minha surpresa, fui informado de que o pedido correto só foi efetivado em 16/08/2025 (*****), e que o número inicialmente informado pela concessionária estava incorreto. Essa inconsistência nunca foi comunicada, e explica, em parte, o atraso no processo.<br /><br />Segundo a VW, o faturamento está previsto entre 17/11 e 23/11, o que significa entrega apenas em dezembro, muito além do prazo inicialmente informado.<br /><br />Diante disso, solicito que a VW e a concessionária priorizem o faturamento e a entrega do veículo, considerando que o atraso não decorre de minha parte, mas de erro administrativo e falta de transparência no processo.<br /><br />Atenciosamente,<br />*****",SP,Ourinhos,PENDING,2025-10-16T09:58:48,https://www.reclameaqui.com.br/volkswagen/atraso-na-entrega-de-veiculo-vw-polo-pcd-e-falta-de-transparencia-no-processo-de-compra_aPBEyy2E0Yj44lAc/
Carro zero km parado por falta de peça (chicote elétrico) - Logística ineficiente da Volkswagen,"Comprei um carro zero km na concessionária GuaibaCar (Canoas/RS) e, com menos de 600 km rodados, já estou enfrentando um problema sério: meu veículo está parado por falta de uma peça simples chicote elétrico (código 2GP971095B).<br /><br />A concessionária mais próxima da minha residência, Carburgo (Novo Hamburgo/RS), informou que a peça está em BO (backorder), bem como GuaibaCar (Canoas/RS), ou seja, sem previsão de entrega. Por conta disso, estou sem poder utilizar o carro que acabei de comprar e tendo que arcar com custos de aluguel de outro veículo para poder trabalhar e manter minhas atividades.<br /><br />É inaceitável que um carro novo fique parado por tempo indeterminado por falta de uma peça tão básica, evidenciando uma falha grave na logística da Volkswagen. Como consumidor, me sinto enganado e desrespeitado, já que adquiri um veículo novo justamente para ter tranquilidade e segurança, e não para passar por esse tipo de transtorno.<br /><br />Peço que a Volkswagen trate este caso com urgência e prioridade, fornecendo imediatamente a peça e solucionando o problema, além de apresentar uma posição oficial sobre os prejuízos que estou sofrendo.<br /><br />Essa situação está gerando um profundo desgaste emocional e financeiro, e não condiz com a reputação da marca. Espero uma solução rápida e eficaz.<br /><br />PEDIDO: *****",RS,Campo Bom,ANSWERED,2025-10-16T09:45:41,https://www.reclameaqui.com.br/volkswagen/carro-zero-km-parado-por-falta-de-peca-chicote-eletrico-logistica-ineficiente-da-volkswagen_U6DUIgKjIzhAtC5Z/
Cobrança [Editado pelo Reclame Aqui] e falta de solução para problema de software na concessionária Volkswagen.,"Infelizmente precisei abrir um reclame aqui para resolver o problema de SAFE CP no painel do meu carro, a Volkswagen entrou em contato comigo explicando a situação e informando que a Green Veículos na Giovanni Gronchi iria fazer a atualização do software gratuitamente, quando fui agendar para resolver esse problema a concessionária me informou que estava com problema no software e que não conseguiria resolver a questão, mas estranhamente dois dias antes eles estavam me cobrando 800,00 para resolver! <br />Peço ajuda!",SP,São Paulo,PENDING,2025-10-16T09:21:15,https://www.reclameaqui.com.br/volkswagen/cobranca-editado-pelo-reclame-aqui-e-falta-de-solucao-para-problema-de-software-na-concessionaria-volkswagen_U_ws4l2bBB04CNmh/
"Para-brisa trincado e falta de peça para T-Cross 2024 impede uso do veículo, gerando prejuízo e possível ação judicial.","Volkswagem nunca mais !!<br /><br />Total desrespeito com o cliente!! Meu para-brisa do carro trincou modelo T-Cross Higline 2024, solicitei diretamente para concessionária a troca e a mesma entrou com pedido porém informou que está em falta na fábrica e sem previsão.<br /><br />O detalhe que estou com o carro parado sem poder utilizar o mesmo, vou solicitar via judicial um reembolso reparatório dos dias que fiquei sem condições de trabalhar.<br /><br />Resumindo: Volkswagem nunca mais !!",RS,Gravataí,PENDING,2025-10-16T09:19:01,https://www.reclameaqui.com.br/volkswagen/para-brisa-trincado-e-falta-de-peca-para-t-cross-2024-impede-uso-do-veiculo-gerando-prejuizo-e-possivel-acao-judicial_sQ3Q2iW81EAKQsTc/
Volkswagen Nivus 2026 com defeito de fabricação no freio ABS e atendimento pós-venda insatisfatório,"Volkswagen Nivus Sense 2026 com Defeito de fabricação no Sistemas de Freio ABS.<br /><br />Optei por comprar um carro zero KM, pensando em fugir de oficinas por um bom tempo, mas fui resolver comprar um Volkswagen Nivus Sense 2026 e aí que o planejamento de evitar oficinas deu errado. Retirei o carro dia 19.08.25 da Concessionária Distac em Campo Grande Município Rio de Janeiro e apenas com 1 mês de uso, isso mesmo, apenas 1 mês de uso e já estou a pé, o carro se encontra na oficina autorizada sem previsão de resolução do problema. O defeito começou com luzes de alerta do sistema de controle de estabilidade o ESC, acessa, depois acenderam luzes de alerta pressão de pneus, falhas no Front Assist. falhas no sistema start Stop e sensores de estacionamento parou de funcionar, então pensei carro com apenas 1 mês de uso, vou levar na autorizada na mesma concessionária que comprei, volkswagen distac de Campo Grande na Avenida Cesário de Melo, município Rio de Janeiro, aí já viu né uma coisa é o atendimento na venda do veículo outra totalmente diferente é o pós venda no atendimento na oficina da concessionária. Pois bem, chegando na oficina da agência para descrever o defeito do veículo já recebi um &quot; espera aí fora&quot;, depois de uma hora esperando preenchidos vários formulários fui atendido, mecânico falou precisar passar scanner, mas iria demorar pois oficina cheia, depois de mais 1 hora de espera o mecânico informou que após passar scanner, não conseguiu identificar o defeito com precisão, mas provavelmente defeito de fábrica sistema de freios ABS, e não consegue resolver, vai precisar entrar em contato com fábrica, pergunto previsão de reparo? Resposta não existe, o carro vai precisar ficar na oficina, pois estava correndo risco de acidente por falhas no freio. Obviamente não era o que esperava pois como disse o carro tem apenas 1 mês de uso, informei ao mecânico que estava com viagem marcada com carro, casa alugada e pessoas me esperando, resposta dele não posso fazer nada, liguei para atendimento ao cliente Volkswagen informando o acontecido e prejuízos e transtornos, principalmente com viagem marcada e nenhuma previsão de entrega do veículo, então o atendimento especializado ao cliente da Volkswagen pediu para falar com chefe da oficina para conseguir um prazo para me dar, mas pasmem o chefe da oficina na minha frente falou que não iria falar com ninguém pelo telefone e acabou, aí realmente fiquei com impressão de estar em uma empresa de fundo de quintal, mas estava dentro de uma autorizada Volkswagen com um carro com 1 mês de uso com defeito de fabricação no freio ABS e com funcionários que não se entendem. Conclusão permaneço sem carro sem previsão de entrega e com sentimento de ter feito uma péssima compra.",RJ,Rio de Janeiro,PENDING,2025-10-15T23:02:45,https://www.reclameaqui.com.br/volkswagen/volkswagen-nivus-2026-com-defeito-de-fabricacao-no-freio-abs-e-atendimento-pos-venda-insatisfatorio_IHC4DHCA4U1kJvZ8/
Propaganda enganosa e tentativa de venda por preço superior ao anunciado - VW Polo Track,"No dia 01/10/2025 apareceu um anúncio patrocinado da VW ( no site oficial da marca) para um Polo Track com preço promocional. <br /><br />Após preencher o formulário, a equipe de vendas da concessionária da minha região entrou em contato.<br /><br />Colocaram um vendedor com quem eu já tinha tido uma experiência ruim anteriormente (em um evento promocional, ele tentou vender o carro por um preço maior do que o normal, mesmo após me chamar para a promoção).<br /><br />Pedi para falar com outro vendedor. Então me direcionaram para outro, mas esse já veio com um preço mais alto do que o divulgado no anúncio patrocinado. Eu já havia tirado print da tela com o preço e, ao mostrar, a resposta foi discutir de forma desagradável, dizendo que o valor era do mês passado. Mesmo enviando o print, insistiram na versão deles.<br /><br /><br />Isso é uma falta de respeito com o cliente: chamar para comprar por um preço e depois tentar negociar valores maiores.<br /><br />Trata-se de propaganda enganosa, e a equipe parece estar preparada apenas para discutir, e não para vender, como se o cliente fosse desinformado ou não entendesse.",TO,Palmas,ANSWERED,2025-10-15T19:56:18,https://www.reclameaqui.com.br/volkswagen/propaganda-enganosa-e-tentativa-de-venda-por-preco-superior-ao-anunciado-vw-polo-track_gL2Psw-GtRTEOHtO/
Atraso na entrega da grade do parachoque do carro,"estou com um carro parado aguardando uma grade do parachoque desde o dia 14 de setembro ,protocolo<br />numero *****<br />protocolo *****<br />,nao entendo ,um carro com um preço tão alto e não tem pecas de reposição.<br />aguardo retorno.<br />",DF,Brasília,PENDING,2025-10-15T19:40:20,https://www.reclameaqui.com.br/volkswagen/atraso-na-entrega-da-grade-do-parachoque-do-carro_Zxvw4XKbEP24qUTY/
Negativa de garantia para DRL amarelado em VW T Cross 0km,"Adquiri um VW T Cross 0km em Abril de 2023!<br />Participo de alguns fóruns automobilísticos e vi na ocasião muitas reclamações do Drl que amarelava com o tempo.<br />No momento da compra questionei a vendedora quanto a cobertura da garantia em relação a este defeito.<br />Ela informou que sim e também todos os outros componentes cobertos pela garantia.<br />Fiz a garantia estendida por mais 2 anos além dos 3 já fornecidos.<br /><br />Agendei a revisão de 40.000km para o dia 13/10/25 e questionei que fizessem a verificação do drl amarelado do meu veículo.<br />Hoje dia 15/10/25 na retirada do mesmo a substituição foi negada onde me informaram que o Drl está ok.<br />Quando adquiri o veículo ele era totalmente branco, ao passar um tempo ele ficou amarelado e a concessionária fala que é normal!?<br />Gostaria de uma avaliação detalhada deste caso. Uma vez que na aquisição do veículo a vendedora informou se o farol amarelasse a garantia trocava.<br />Aguardo um breve retorno.<br />",SP,São Paulo,ANSWERED,2025-10-15T18:34:01,https://www.reclameaqui.com.br/volkswagen/negativa-de-garantia-para-drl-amarelado-em-vw-t-cross-0km_I7eXmcKqR-k2TpoK/
VW PROTEGE não cumpre reposição de vidro quebrado em tempo hábil,"Ao comprar o novo TERA, adquiri o pacote do VW PROTEGE, plano mais caro! Tive meu vidro quebrado e NÃO TEM VIDRO PARA TROCAR. Me deram prazo de 10dias úteis! Como eu vou ficar 10dias se usar o carro?! Carro novo, TEM QUE TER PEÇA DE REPOSIÇÃO! ABSURDO E MUITO DECEPCIONADA!",RJ,Rio de Janeiro,PENDING,2025-10-15T18:07:26,https://www.reclameaqui.com.br/volkswagen/vw-protege-nao-cumpre-reposicao-de-vidro-quebrado-em-tempo-habil_2MFS6xrgr8-bExbc/
