title,description,userState,userCity,status,created,url
"T-Cross 2025/2026 com múltiplos problemas: bateria, injeção, freio e ar condicionado","Em Setembro de 2025 , comprei um veículo zero kilometro na concessionária Diauto da Volkswagem , situada na ***** em *****. Trata - se de um veiculo T-cross 2025/2026 , que em menos de um mês apresentou problemas na bateria , apresentando problemas com zinabre,afetando  tbem o cabo da bateria e o cabo Startstop. Levei o carro até a loja e foi realizada a troca da bateria , faltando trocar os cabos da bateria e caboStartstop.A concessessionária DIAUTO - Volks em 09/10/2025 em contato no meu celular mencionou que essas peças não estão disponíveis em estoque nem na rede de compra , pois o módulo é exclusivo e codificado especificamente para o meu carro. Diante dessa posição fiquei aguardando a chegada das peças para troca. Na data de 11/10/2025 ascendeu uma luz amarela no painel do carro, com indicativo de possível problema na injeção eletrônica e em contato com a funcionária Renata da concessionária Diauto Volkswagem foi dito pela mesma que poderia ser problema de combustível. Para minha surpresa em 20/10/2025 o veículo apresentou problemas no freio e no ar condicionado. Diante dos fatos, é inadimissível que um veiculo zero de tantos problemas ! O veículo encontra-se estacionado na Loja Diauto aguardando a chegada das peças e enquanto isso não tenho nenhum retorno da Volkswagem sobre prazo ou sobre possibilidade de ficar com um carro reserva.",SP,São Paulo,PENDING,2025-10-22T15:26:59,https://www.reclameaqui.com.br/volkswagen/t-cross-20252026-com-multiplos-problemas-bateria-injecao-freio-e-ar-condicionado_5tFs82PpVxF42M3H/
Solicitação de revalidação do certificado de garantia do veículo Virtus Highline 2024,"Boa tarde!<br /><br />Solicito, por gentileza, revalidação do certificado de garantia de meu veículo Virtus Highline 2024.<br /><br />A primeira revisão foi realizada pelo antigo proprietário com 12.184km, pouco acima do estabelecido, porém, na concessionária Original Veículos informaram que o veículo estava na garantia de fábrica. No app Meu VW, o certificado encontra-se indisponível.<br /><br />Estou tentando atendimento na concessionária por ligação, tentei e por diversas vezes não consigo atendimento.<br /><br />Se necessário, posso levar meu veículo até uma concessionária mais próxima para que façam uma avaliação presencial. O veículo está atualmente com 18.000km e tudo funcionando.<br /><br />Agradeço o atendimento.<br /><br />Abraços.",MG,Santa Rita do Sapucaí,ANSWERED,2025-10-22T15:00:58,https://www.reclameaqui.com.br/volkswagen/solicitacao-de-revalidacao-do-certificado-de-garantia-do-veiculo-virtus-highline-2024_f9O6V8a8-WXPjyrA/
"T-Cross TSI 200 zero km com problemas no sistema de ventilação e maçaneta, descaso no pós-venda","Comprei numa concessionária, veículo Volkswagen, modelo T Cross, TSI 200, zero-quilômetro, em junho de 2024.<br /><br />Para a minha decepção, em pouco mais de 1 ano e com 13.000 km, o Veículo T Cross TSI 200, ano modelo 24/24, começou a apresentar problemas.<br /><br />Descrevo abaixo os problemas apresentados e o descaso da Volkswagen com o consumidor no pós venda.<br /><br />Cumprindo orientação de fábrica, em abril de 2025, após completar 10.000 km rodados, levei o veículo para a primeira revisão, à Concessionária Brasilvagen, localizada na avenida Moreira Guimarães.<br /><br />Após 5 meses da primeira revisão, o veículo Volkswagen T cross - TSI 200, apresentou dois problemas:<br /><br />Inicialmente a maçaneta interna da porta traseira direita, simplesmente caiu<br />Depois o Sistema de Ventilação parou e por essa razão o ar condicionado também deixou de funcionar, tornando a permanência dentro Veículo Volkswagen T Cross TSI 200, completamente insalubre e insegura, além de provocar desgastes desnecessários de alguns componentes:<br /><br />insalubre, em razão da temperatura interna do veículo se tornar insuportável devido ao calor excessivo.<br />insegura, pois devido ao problema no sistema de ventilação, é necessário transitar de vidros abertos, devido ao calor, mesmo assim com temperaturas acima do normal;<br />desgaste desnecessários da máquina que abre e fecha os vidros, pois é necessário abrir e fechar os vidros o tempo todo, ou seja, quando o Veículo para no semáforo, por segurança, é necessário fechar os vidros. Quando o veículo se movimenta os vidros são abertos. Isso ocorre o tempo todo.<br />Além disso, ao ser necessário transitar em dias de chuva com os vidros abertos, chove dentro do veículo, causando desgastes.<br /><br />CONTATO COM A VOLKSWAGEN<br /><br />Para solucionar os problemas que conforme relato, ocorreram dentro do prazo de garantia pela Volkswagen, procurei inicialmente a Brasilwagen Aeroporto, em razão da primeira revisão ter sido feita lá.<br />Recebi da Concessionária, a informação de que eu deveria procurar outra concessionária, pois eles (concessionária) só faziam revisão e não diagnóstico. Indicaram a Concessionária Volkswagen Brasilwagen, localizada na Avenida Hélio Pellegrino, 1210.<br />Diante dessa informação, argumentei com a Concessionária Volkswagen Brasilwagen Aeroporto, que eu havia feito a primeira e única revisão naquele Estabelecimento e que só eles haviam feito manutenção no Veículo e por essa razão eu não compreendi a recusa em fazer o diagnóstico. Após muita insistência, eles agendaram para que eu retornasse depois de 30 dias. Após alguns dias, percebi que o problema no sistema de ventilação, não poderia aguardar esse prazo para ser solucionado e mesmo com esse agendamento distante, procurei a Brasilwagen da Avenida Hélio Pellegrino.<br /><br />Agendei dia 22/09/2025, na Brasilwagen Hélio Pellegrino, para realizar o diagnóstico.<br />Chegando lá, fui recebido pela Consultora Sra. *****, que me orientou a aguardar 3 dias.<br /><br />Em 24/09/2025, recebi via whatsapp, a informação que a maçaneta foi reposicionada e que foi solicitada a peça do sistema de ventilação.<br /><br />Ao retirar o veículo, a Consultora Sra *****, informou que no prazo de 5 a 7 dias úteis, a peça chegaria para que fosse solucionado o problema.<br /><br />Ocorre que, expirado o prazo dado pela Concessionária Volkswagen Hélio Pellegrino, até o presente momento nunca fui contatado pela volkswagen, no mínimo para justificar que a peça não chegou no prazo estipulado pela própria Volkswagen.<br /><br />No dia 16/10/2025, entrei em contato novamente com a Concessionária Volkswagen Hélio Pellegrino, cobrando informações sobre o atraso na chegada da peça e informando sobre os graves problemas causados em decorrência da parada do sistema de ventilação. Recebi a informação que a peça estava em BO e sem previsão de chegada. <br /><br />Cobrei uma solução urgente, reportando os infortúnios que eu estava passando em decorrência do problema e solicitei uma solução, à luz do Código de Defesa do Consumidor. Fui informado que o problema não estava na Concessionária, pois dependia da Fábrica VOLKSWAGEN enviar a peça.<br /><br />Em 17/10/2025, entrei em contato com a Volkswagen, via telefone *****, abri o protocolo *****. Foi solicitado 1 dia útil para retorno. Após esse prazo, ninguém retornou.<br /><br />Em 21/10/2025, 14h, entrei novamente em contato, cobrando o retorno pendente por parte da Volkswagen. Fui informado que o problema estava com o Sr. *****, da Fábrica. Informei que após esse prazo, eu iria procurar meu direito enquanto CONSUMIDOR, abrindo reclamação em outras esferas, além de publicizar e dar visibilidade ao problema, com o intuito, inclusive de proteger meu DIREITO e dos demais CONSUMIDORES. Protocolo *****.<br /><br />Estou bastante decepcionado com a Fábrica Volkswagen, desde os problemas apresentados com o carro na garantia,  ainda com pouco uso e adquirido zero quilômetro na Concessionária Volkswagen, além do DESCASO no Pós Venda. <br />",SP,São Paulo,PENDING,2025-10-22T14:03:09,https://www.reclameaqui.com.br/volkswagen/t-cross-tsi-200-zero-km-com-problemas-no-sistema-de-ventilacao-e-macaneta-descaso-no-pos-venda_3oUqWQuhu7prhRrU/
"Carro novo com avaria no teto apresenta problemas após tentativa de reparo, gerando insatisfação do cliente.","Meu carro veio com uma avaria no teto lado do passageiro! <br />Foi para revisão , mostrei o defeito e foram tentar arrumar e piorou, resolveram trocar a peça interna ( teto) e a peça ficou pior do que já estava! Meu carro tem 2000 km e eu perdi totalmente a vontade de entrar no carro pq eu não comprei um carro velho, eu comprei um carro novo para não ter problemas, e não é a primeira vez que me decepciono com a VW! Preciso de socorro por parte da equipe ou departamento responsável!",SP,Taboão da Serra,PENDING,2025-10-22T13:43:19,https://www.reclameaqui.com.br/volkswagen/carro-novo-com-avaria-no-teto-apresenta-problemas-apos-tentativa-de-reparo-gerando-insatisfacao-do-cliente_10x0vvK8srnuN30j/
Falta de atendimento e posicionamento da concessionária Toriba após reclamação sobre problema de injeção.,"No mês passado o meu carro acendeu a luz de injeção. Levei prontamente o veículo a uma concessionária, mas não tive atendimento. Fiz diversas reclamações sobre o ocorrido, mas não tive nenhum posicionamento por parte da Toriba.",SP,São Paulo,PENDING,2025-10-22T13:43:15,https://www.reclameaqui.com.br/volkswagen/falta-de-atendimento-e-posicionamento-da-concessionaria-toriba-apos-reclamacao-sobre-problema-de-injecao_f0ehWwQGMmjbiB1_/
Cobrança de diagnóstico de ar condicionado após o término da garantia do veículo VW Nivus,"Quero registrar minha insatisfação com a VW, meu veículo um Nivus, finalizou a garantia no mês passado e para o meu azar o ar condicionado deixou de funcionar. Levei o veículo para uma concessionária para verificar e fazer o orçamento para realização do reparo. Porém para que fosse feito o diagnóstico seria cobrado um valor absurdo de R$ 780,00. Somente para saber o motivo do não funcionamento do ar condicionado. É terceiro veículo que compro dessa marca todos comprados zero km. Porém vou repensar a próxima escolha. Fiquei com a impressão que o defeito só surge após o término da garantia, digo isso porque no meu veículo anterior dessa mesma marca VW Polo aconteceu algo parecido.",BA,Salvador,ANSWERED,2025-10-22T13:28:17,https://www.reclameaqui.com.br/volkswagen/cobranca-de-diagnostico-de-ar-condicionado-apos-o-termino-da-garantia-do-veiculo-vw-nivus_Bo88UI4Ek4_kkXC5/
Recall não realizado impede licenciamento do veículo,"Bom dia!<br /><br />Desde que a VW anunciou o recall, eu entro em contato com as agências da minha cidade e de cidades vizinhas.<br />Já me falaram que havia uma fila e colocariam meu nome nela, pois as peças seriam enviadas as lojas em 3 meses e me informariam uma data de quando poderia ir.<br />Retornando contato com essa mesma agência, me informaram que essa fila de espera não estava mais funcionando, que somente entrando em contato para agendar, mas que a peça ainda não havia sido enviada e não tinha previsão.<br />Nas outras 3 agências que entrei em contato, sempre a mesma resposta, que não há peças para fazer o racall e, que estão sem previsão de quando irão receber.<br /><br />Meu licenciamento será renovado agora em novembro, mas sem o recall feito, não será possível.<br /><br />Como que procede em uma situação dessa?<br /><br />Preciso fazer o recall no meu veículo, para ficar com a documentação certa.<br />",SP,Santana de Parnaíba,PENDING,2025-10-22T12:46:41,https://www.reclameaqui.com.br/volkswagen/recall-nao-realizado-impede-licenciamento-do-veiculo_IYZfUMxhB8pYL2N-/
Demora na solução de problema no módulo de ré de carro 0km,"Comprei o carro 0 km Veio com problema no módulo de ré, Faz mais de 2 meses e não Resolveram. O módulo passou mais de um mês para chegar na concessionária, E faz quase um mês que tô esperando eles marcar Para ser trocado. Peguei o carro dia 11/08 No mesmo dia relatei o problema, O módulo só veio chegar dia 19/09. E hoje já é 06/10. E até hoje não foi trocado. Não indico comprar nessa loja O pós-venda é horrível. Depois que eles recebem o dinheiro Tão nem aí mas para você.",PE,Sirinhaém,ANSWERED,2025-10-22T12:32:30,https://www.reclameaqui.com.br/volkswagen/demora-na-solucao-de-problema-no-modulo-de-re-de-carro-0km_ov1V--6hLNNR_3C3/
Demora excessiva na entrega de peças para conserto de veículo sinistrado,"Bati o carro e dei entrada no sinistro no dia 18 de agosto, e até hoje não tem as peças pra consertar o carro, mais de 3 meses e as peças não chegaram e ainda sem previsão, isso é uma [Editado pelo Reclame Aqui]! Comprei 2 carros, uma tiguan e o virtus, o virtus batido e sem previsão de peças, eu eu com medo de andar com a tiguan, acontecer um acidente e também não ter peças, uma [Editado pelo Reclame Aqui]! Vou consertar meu carro, vou vender os dois, e nunca mais em minha vida compro um carro nessa empresa, total descaso e desrespeito com o cliente.",BA,Salvador,PENDING,2025-10-22T10:04:04,https://www.reclameaqui.com.br/volkswagen/demora-excessiva-na-entrega-de-pecas-para-conserto-de-veiculo-sinistrado_A5svRkQCcrRYiMk_/
Atraso na baixa de recall e bloqueio do CRLV impedem transferência de veículo Volkswagen,"Bom dia,<br /><br />No dia 06/10/2025, realizei um recall do meu veículo em uma concessionária autorizada da Volkswagen. Na ocasião, houve atraso na entrega, o que já causou transtorno. Entretanto, o problema maior é que, passados 15 dias, o recall ainda não foi baixado no sistema.<br /><br />Hoje, 22/10/2025, entrei em contato com o atendimento da Volkswagen e fui informado de que o prazo seria de 30 dias para atualização. Além disso, a atendente afirmou que o status de recall pendente no site da Volkswagen se deve a uma suposta manutenção do site, o que considero uma justificativa inaceitável.<br /><br />Conforme previsto no Art. 6, 1, da Portaria Conjunta n 3/2019 (MJSP/MInfra), o prazo para baixa do recall é de 15 dias corridos, e não 30 dias, como alegado pela empresa.<br /><br />Devido a esse atraso, meu veículo consta como bloqueado no CRLV, impossibilitando a transferência de propriedade e me impedindo de regularizar a situação junto ao Detran. A situação se torna ainda mais absurda porque, segundo o próprio atendimento da Volkswagen, após 30 dias apenas o proprietário registrado pode solicitar providências, <br />criando um paradoxo: não posso transferir o veículo porque o recall não foi baixado, e não posso solicitar nada porque ainda não sou o proprietário no documento. rs<br /><br />Saliento que já tive experiências com outras montadoras (FIAT e Honda) e nunca enfrentei esse tipo de problema.<br /><br />Diante disso, solicito a imediata regularização do recall, a baixa no sistema da Volkswagen e do Detran, e uma posição formal da empresa sobre o descumprimento do prazo legal.",RJ,Belford Roxo,PENDING,2025-10-22T09:48:45,https://www.reclameaqui.com.br/volkswagen/atraso-na-baixa-de-recall-e-bloqueio-do-crlv-impedem-transferencia-de-veiculo-volkswagen_nUMLk9O14G8zLeUM/
Barulho no motor com 2000km e SAC inacessível: decepção com a Volkswagen,"Bom dia. Comprei uma saveiro a 2 meses<br />Veículo se encontra hoje com 2000km rodados, deixei na concessionária porque apresentou barulho no moto, ontem fui informado pelo técnico de oficina que o barulho poderia ser sujeira no tucho, que nao foi um diagnóstico certo, me pediram pra levar álcool para testar o veículo porque eu estava usando gasolina, então questionei, se o carro e flex o que tem a ver o combustível. <br />Questionei também se tinha sido verificado o filtro de combustível do veículo,  e fui informado que estava limpo, filtro limpo e sujeira no pistão nao da pra entender, nao e possível um veículo com 2000km estar com sujeira no pistão e o filtro de combustível limpo.<br /><br />O sac da Volkswagen agente nunca consegue falar.<br /><br />A distac, empresa onde comprei o carro disse que realizou todos os testes que a fábrica mandou e está querendo me entregar o veículo sem ter resolvido o problema. <br /><br />Foi uma grande decepção com a Volkswagen",RJ,Duque de Caxias,PENDING,2025-10-22T08:46:18,https://www.reclameaqui.com.br/volkswagen/barulho-no-motor-com-2000km-e-sac-inacessivel-decepcao-com-a-volkswagen_U-v9sj5tXA0dlHhB/
Falhas graves no Start-Stop e ACC do Virtus 0km - Risco de Acidente,"Título da Reclamação:<br /><br />Virtus 0 km com falhas graves no Start-Stop e no sistema ACC (anti-colisão)  risco de acidente<br /><br /><br /><br />Descrição da Reclamação:<br /><br />Comprei um Volkswagen Virtus no dia 20 de junho de 2025, e com apenas 200 km rodados o carro começou a apresentar falhas graves em sistemas de segurança.<br /><br />O sistema Start-Stop está desligando o motor enquanto o veículo ainda está em movimento, entre 4 km/h e 6 km/h, inclusive em subidas, o que faz o carro apagar completamente e até recuar de ré. Isso já quase causou um acidente.<br /><br />Além disso, o ACC (sistema anti-colisão) funciona de forma intermitente, só aciona quando quer, o que é extremamente perigoso para um carro que deveria oferecer segurança ativa e confiável.<br /><br />O veículo foi deixado duas vezes em concessionárias autorizadas.<br />Na segunda vez, ficou na Saga do Gama, entre 20/08/2025 e 27/08/2025, e foi emitido documento por escrito dizendo que o carro não possui nenhum problema.<br />Porém, o defeito continua, e ainda encontrei novas avarias no carro (um amassado na porta e um arranhão no para-choque), sem qualquer explicação ou registro de checklist.<br /><br />Já testei outros carros do mesmo modelo e ano, inclusive no show-room da própria Saga, e nenhum apresentou o mesmo comportamento.<br /><br />Estou extremamente insatisfeito e preocupado com a segurança da minha família.<br />O carro apresenta falhas sérias no sistema eletrônico, e até agora não obtive nenhuma solução efetiva da concessionária ou da Volkswagen.<br /><br />Peço uma análise técnica imediata e definitiva, preferencialmente com acompanhamento da Volkswagen do Brasil, e uma solução concreta, seja o reparo real, substituição do veículo ou qualquer providência que garanta a segurança plena do automóvel.<br /><br /><br /><br />Dados para referência (caso queira incluir no campo de observações):<br />Nome: *****<br />CPF: *****<br />Telefone: *****<br />Placa: *****<br />Chassi: *****<br />Concessionária: Saga do Gama  DF<br />",DF,Brasília,ANSWERED,2025-10-21T22:50:10,https://www.reclameaqui.com.br/volkswagen/falhas-graves-no-start-stop-e-acc-do-virtus-0km-risco-de-acidente_18wJsUgZDCEKs86i/
Revisão duplicada no app Minha Volkswagen - Solicitação de correção,"No app Minha Volkswagen a última revisão foi registrada duas vezes como tendo sido feita 3a e 4a revisão, porém eu só realizei as 3 primeiras revisões. Favor, excluírem a 4a revisão do essa não existe.",AL,Maceió,PENDING,2025-10-21T21:35:24,https://www.reclameaqui.com.br/volkswagen/revisao-duplicada-no-app-minha-volkswagen-solicitacao-de-correcao_tG6DpPUrtcfc36XH/
Recall de airbag: Agendamento demorado e descaso da concessionária Volkswagen,"Recebi uma notificação no aplicativo da Carteira Digital de Trânsito informando sobre um recall de segurança referente ao gerador de gás do airbag do passageiro do meu veículo (código 9BW2025009).<br />A descrição do recall informa que:<br /><br />O propelente de um lote de gerador de gás pode degradar-se após longos períodos de exposição a variações térmicas e umidade. Em caso de deflagração, o gerador pode romper-se, projetando fragmentos com risco de danos físicos ou fatais.<br /><br />Diante da gravidade do alerta, entrei em contato com a Volkswagen, que me orientou a ligar diretamente para a concessionária mais próxima.<br />Na concessionária, fui informada de que:<br />O único encaixe disponível seria para o dia 30/10/2025, desde que eu deixasse o carro às 8h da manhã e buscasse apenas no final do dia;<br />Caso eu precisasse de um horário agendado, a primeira data disponível seria apenas em 10/03/2026, ou seja, cinco meses depois.<br /><br />Expliquei que utilizo o carro para trabalhar e que, conforme a própria central da Volkswagen, o reparo leva em média 2 horas. Mesmo assim, a concessionária não demonstrou nenhuma preocupação ou flexibilidade, tratando o caso com total descaso.<br /><br />Considero inaceitável que um recall de segurança, com risco de lesões graves ou fatais, seja tratado com tamanha negligência e falta de prioridade.",GO,Valparaíso de Goiás,PENDING,2025-10-21T21:31:19,https://www.reclameaqui.com.br/volkswagen/recall-de-airbag-agendamento-demorado-e-descaso-da-concessionaria-volkswagen_V-IuprjCt84DN4QQ/
Macaco do carro com defeito e dificuldade na troca de pneu,"Olá. Sou proprietário de um Polo Comfortline 2020 comprado 0km em fevereiro de 2020. Desde que comprei o carro e comecei a utilizá-lo, nunca tive problemas de pneu furado que me fizessem utilizar o macaco do carro para efetuar uma troca. Porém, tudo isso mudou faz duas semanas. No meu trajeto para o escritório, apareceu no painel o aviso de pressão baixa nos pneus e realmente o pneu traseiro direito havia furado. Como seria a primeira vez que iria utilizar o macaco do carro imaginei que tudo iria ocorrer bem e que eu iria conseguir efetuar a troca do pneu. Entretanto, para minha surpresa, não foi isso que aconteceu.<br /><br />Na hora que o macaco começava a elevar o carro, ele se soltava da manga lateral onde ele encaixa no carro e, consequentemente derrubava o carro no chão. Tentei duas vezes e tive o mesmo resultado. Incomodado com a situação, acionei o seguro para enviar alguém para me ajudar. E mesmo esta pessoa, que tem mais experiência que eu tentando realizar a troca, ela teve o mesmo resultado. Quando paramos para olhar o macaco, vimos que ele está soldado torto na parte do macaco que encaixa na manga do carro. <br /><br />Fui até a concessionária autorizada em que sempre levei meu veículo para manutenção e, para minha surpresa, falaram que nada podem fazer. Gostaria de solicitar que seja feita a troca do macaco do meu carro por uma nova peça e que funcione. Visto que este é um item de segurança e uma peça que não possui vida útil.<br /><br />Aguardo um retorno.<br />",SP,São Paulo,PENDING,2025-10-21T20:46:52,https://www.reclameaqui.com.br/volkswagen/macaco-do-carro-com-defeito-e-dificuldade-na-troca-de-pneu_rOUrOQBy__jVf4Q8/
"T-Cross 2026 zero km com defeitos: riscos, defeito na pintura, bolhas na película, pintura e atraso na entrega da solução","No mês de julho de 2025, comprei na concessionária Carrera Villa Lobos um veículo T-Cross Sense 2026, placa *****, zero quilômetro. A retirada do veículo ocorreu no dia 22/07/2025<br /><br />No ato da entrega, constatei os seguintes problemas:<br /><br />Riscos visíveis em toda a lataria;<br />Bolhas na película protetora das quatro janelas (serviço contratado à parte);<br />Partículas sob a película, comprometendo a aderência.<br /><br />Imediatamente informei os funcionários identificados como Vagner, Francisco e Leonardo. Foi oferecido um polimento e orientado que aguardasse uma semana para que as bolhas da película desaparecessem.<br /><br />Após o polimento, levei o veículo a um especialista, que constatou riscos generalizados na pintura, além de resíduos de polimento em maçanetas, borrachas, frisos laterais e plásticos.<br /><br />Reiterei por e-mail que os problemas persistiam, sem retorno da concessionária. Compareci à loja em 06/08/2025, ocasião em que o gerente Bruno reconheceu os problemas e informou que faria novo polimento, troca da película e remoção das manchas brancas.<br /><br />Também foi informado ao Bruno sobre um problema constatado na buzina, um delay e dureza na pressão, não dando a possibilidade de um beep rápido e curto.<br /><br />Entreguei o carro para reparos em 07/08/2025. Mais tarde, fui informada de que haviam riscos nas portas laterais esquerdas e que seria necessária pintura no local. Alertei sobre a perda da originalidade do veículo, além de não haver outros riscos além destes realizados pela concessionária.<br /><br />No dia 08/08/2025, após diversas tentativas de obter previsão, retirei o carro e constatei que os problemas persistiam, a saber:<br /><br />Riscos na lataria;<br />Defeito na pintura de fábrica;<br />Manchas brancas; ainda piores<br />Película com mais bolhas.<br /><br />Foi aberto processo no procon contra a Volksvagem, onde a empresa solicitou que levasse o carro novamente para a concessionária para avaliação de um técnico, o qual foi realizado na data de 06/10/2025, onde os defeitos foram constatados pelo técnico: Manchas na pintura, hologramas, manchas de massa de polir em maçanetas, manchas na pintura (defeito de fábrica), borrachas e frisos. Bolhas em todos os vidros.<br /><br />Desde então, solicitei retorno da Volksvagem e até agora não me deram retorno algum.<br />Já abri protocolo na Volksvagem número ***** solicitando que entrem em contato para darem uma posição, já falei com o gerente de vendas da Carrera, Claudio e até agora nada.<br /><br />Informo que possuo fotografias anexas para dar início ao processo.<br /><br />Pedido<br />Substituição do produto/serviço",SP,São Paulo,PENDING,2025-10-21T19:52:10,https://www.reclameaqui.com.br/volkswagen/t-cross-2026-zero-km-com-defeitos-riscos-defeito-na-pintura-bolhas-na-pelicula-pintura-e-atraso-na-entrega-da-solucao_1W6qjmBHaX4gNe73/
