title,description,userState,userCity,status,created,url
Barulho na suspensão não resolvido e falta de atendimento da VW,"Carro apresenta barulho na suspensão desde 12 mil km, reclamado em revisão, informado que estava tudo dentro das características do carro, novamente reclamado e deixado para verificação e após o informado  que estava tudo ok, levado para mais um teste junto co. Testador e informado que era característica do carro, após mais um teste   Avaliação por engenheiro, qual tb não deu um diagnóstico, explicou para entendimento de  leigo e após informou que o atendimento seria dado em conjunto com. A montadora do México. Até o momento sem retorno ou parecer. O que deixa a insatisfação é o pouco caso que a VW dá ao consumidor, sendo que o carro apresenta  problema e não se tem a resolução. [Editado pelo Reclame Aqui] qualidade no pós venda é explicações para leigo entender. Última vez que deixo para ser resolvido, após estarei efetuando a troca da peça com problema e abrindo uma cobrança jurídica por falta de atendimento ao problema.",PR,CURITIBA,PENDING,2025-10-28T16:03:26,https://www.reclameaqui.com.br/volkswagen/barulho-na-suspensao-nao-resolvido-e-falta-de-atendimento-da-vw_iMANcw5TQPtVsu8w/
Vício oculto em câmbio de Nivus Highline 2022 com baixa quilometragem e revisões em dia,"Adquiri para minha mãe, um veículo Volkswagen Nivus Highline TSI 2022, usado, diretamente do proprietário, com apenas 17.000 km rodados. Todas as revisões foram realizadas em concessionária autorizada.<br /><br />Três mês após a terceira revisão, o carro apresentou um defeito: um forte tranco ao engatar a marcha ré. Para evitar maiores danos, o veículo foi encaminhado por guincho até a concessionária Umuarama, em Palmas/TO.<br /><br />Após 7 dias de análise, fui informada de que o problema estava na caixa de câmbio. No entanto, a concessionária alegou que não faz reparos em peças e somente realiza a substituição completa, apresentando um orçamento ABSURDO de aproximadamente R$ 120.000,00 para a troca da peça. (Paguei 117 mil reais pelo carro e a peça é mais cara que o próprio).<br /><br />Ocorre que a garantia do veículo havia vencido há pouco mais de 1 mês, e o carro estava com apenas 36.000 km rodados (aproximadamente) no momento do diagnóstico. Uma peça como o câmbio não deveria apresentar falhas tão precocemente, ainda mais considerando o histórico de revisões em concessionária autorizada e o baixo uso do veículo.<br /><br />Diante da situação, no dia 17/09/2025 conversei com a gerente, que informou que seria enviado um ofício para a fábrica (Volkswagen) solicitando a troca da peça em caráter de cortesia, em razão do vencimento recente da garantia e do histórico de manutenção correta. No entanto, até o momento não obtive retorno. O veículo está na conssessionária desde 09/09/2025, a quase 2 meses esperando.<br /><br />Trata-se de falha precoce e anormal, em veículo sempre mantido com revisões em concessionária autorizada, configurando claramente vício oculto previsto no art. 18 do Código de Defesa do Consumidor. Além disso, existem diversas reclamações públicas semelhantes, o que demonstra tratar-se de defeito recorrente, passível até mesmo de recall.<br />Peço pela substituição integral da caixa de câmbio sem custo, ou, alternativamente, apresentação de proposta justa de reparo (com garantia nesse reparo), além da possibilidade de fornecimento de veículo substituto durante o período de reparo/análise.",TO,Porto Nacional,PENDING,2025-10-28T15:46:35,https://www.reclameaqui.com.br/volkswagen/vicio-oculto-em-cambio-de-nivus-highline-2022-com-baixa-quilometragem-e-revisoes-em-dia_5Rnsna6LOHVwZBJz/
"NIVUS HL TSI 2023 com defeito no AIRBAG, peça sem previsão da VOLKSWAGEN.","Compramos um carro para meu filho Volkswagen NIVUS HL TSI, 2023, zero KM, hoje está com uma quilometragem de aproximadamente, 15.500 km, com 02 revisões feitas na concessionária conforme manual de proprietário. Quando no dia 15/09/2025 começou a aparecer uma luz de alerta do AIRBAG, levamos de imediato na concessionaria DISCAUTOL, localizada na Av. Mato Grosso em Campo Grande MS.<br />Segundo o atendente, Bruno, que recebeu o veículo, verificou a avaria e me informou que o mesmo serie entregue no mesmo dia, meu filho ligando, foi informado que o mesmo deveria ficar de 24 a 48 horas, para detectar o problema, passado prazo, não mais foi informado, nem tempo, nem previsão da reposição da peça. <br />Do dia 15/10/25 a 18/10/25, fiquei sem carro, solicitando um carro reserva, para que meu filho pudesse trabalhar, assim conseguiram, junto a LOCALIZA, um FIAT Cronos, a locadora me passou com prazo de 7 dias, o Bruno, atendente da Discautol, pediu que assim que pegasse esse veículo, voltasse a Volkswagen para assinar o documento do prazo da locação. Chegando lá no retorno, meu filho foi surpreendido com a informação, que o prazo de locação do veículo seria estendido, para 45 dias, sem nenhuma satisfação. <br />Meu filho, liga dia sim dia não, solicitando uma posição da peça, NADA INFORMADO, no dia 24/10/25, fui até a DISCAUTOL, falar com o gerente Daniel, pedindo um prazo para essa peça, o mesmo me informou que eles NÃO TEM PRAZO, NEM PREVISÃO, achei um absurdo, me pediu que eu mesma entrasse em contato com a FABRICA, no *****, fiz de imediato, ali falei Atendente Mauricio, Protocolo *****, aonde descobri que o pedido da peça, PEDIDO *****, teria sido feito em 15/9/25, mas que ele não poderia me passar nenhuma posição, APENAS pedir que a ÁREA TECNICA entrasse em contato, assim o fez e me deu prazo de 1 DIA ÚTIL. Aguardei a ligação e ninguém entrou em contato.No dia 28/10/25, finalizado prazo dado de 1 dia útil, liguei novamente na FÁBRICA, e falei atendente CAIO, ele me informou que nada poderia fazer a não ser pedir agilidade da Área Tecnica, para entrar em contato e NÃO ME PASSOU PRAZO.<br />Estamos aqui sem PREVISÃO, MUITO MENOS uma EXPLICAÇÃO, para esse problema, CARRO nem sabemos quando terei de volta, isso é ABSURDO, no mínimo a Fábrica ou a Concessionária, Volkswagem, tinha que dar uma explicação e um prazo.<br /><br />",MS,Campo Grande,PENDING,2025-10-28T15:44:14,https://www.reclameaqui.com.br/volkswagen/nivus-hl-tsi-2023-com-defeito-no-airbag-peca-sem-previsao-da-volkswagen_-ERr4qpHAtD3woMe/
Demora na entrega de peça para reparo de veículo Volkswagen após acidente,"Um acidente ocorrido em 12/08/2025, foi acionado a seguradora e a mesma solicitou que fosse feito o reparo na concessionária Volkswagen em *****, porém a falta de uma peça e até hoje a Volkswagen não resolve meu problema, o carro se encontra imobilizado em<br />minha residência!",PR,Telêmaco Borba,ANSWERED,2025-10-28T14:24:46,https://www.reclameaqui.com.br/volkswagen/demora-na-entrega-de-peca-para-reparo-de-veiculo-volkswagen-apos-acidente_O0kGvQsgv78WGob0/
Recall do Voyage G6 não reconhecido após longo período,Efetuei o recall do meu Voyage g6 foi reconhecido agora após longo período está constando que não reconheceu,BA,São Francisco do Conde,ANSWERED,2025-10-28T14:21:39,https://www.reclameaqui.com.br/volkswagen/recall-do-voyage-g6-nao-reconhecido-apos-longo-periodo_3N07heCjyNdNelSp/
Pneus de carro zero km esfarelando e concessionária não resolve,"Vamos lá estou com problemas com a empresa desde o dia 30/09 faz 4 meses que eu comprei o meu carro zero na concessionária Volkswagen E desde setembro os dois pneus dianteiros está apresentando problema acionei a concessionária a concessionária falou que não é com eles e sim com a fabricante dos pneus entrei em contato com a fabricante dos pneus a mesma informou que o problema não são com eles e sim direto com a concessionária analisando fica um jogando para o outro e até hoje ninguém resolveu o meu problema e os meus dois pneus dianteiros eles estão começando a esfarelar,então independente se seja a fabricante ou a concessionária quero que seja resolvido o meu problema,já liguei várias vezes para a concessionária a mesma informação que irá entrar em contato comigo e até hoje nada..",SP,Guarulhos,PENDING,2025-10-28T13:30:39,https://www.reclameaqui.com.br/volkswagen/pneus-de-carro-zero-km-esfarelando-e-concessionaria-nao-resolve_jqCCm12gVLHymkZO/
Problema com farol full led do Polo 2023/2024: Troca completa por queima de LED,"Venho por meio deste registrar minha decepção com o sistema de faróis full led do polo 2023/2024. Simplesmente por queimar uma lâmpada deve-se pagar um absurdo para fazer a troca do farol inteiro, pois o mesmo não está mais na garantia. Como um engenheiro de uma montadota cria um sistema desse com tanta dificuldade quando um reparo deveria ser simples? Por causa de um led de DRL queimado tenho que trocar todo o farol. Absurdo!",PI,Parnaíba,PENDING,2025-10-28T13:21:56,https://www.reclameaqui.com.br/volkswagen/problema-com-farol-full-led-do-polo-20232024-troca-completa-por-queima-de-led_8HiS_JUq3JR6XgGV/
Gol G5 2009: Problemas Recorrentes no Motor e Arrependimento na Compra,"Sempre tive veículos volkswagen, 2 fox, jetta, nunca tive qualquer problema , resolvi comprar um gol g5 2009 1.0 flex , nunca tive um carro que me deu tanta dor de cabeça, o carro esta com 118 mil km, sempre acendendo luz de óleo, aquecendo, baixando água, e por fim queimou a junta do cabeçote , sempre tem reclamação dos mesmos sintomas desse motor, dessa vez estou completamente arrependido de comprar esse carro, estou com ele parado agora q estou desempregado e sem condições e consertar, esse motor realmente e um problema .",MG,Belo Horizonte,PENDING,2025-10-28T13:21:43,https://www.reclameaqui.com.br/volkswagen/gol-g5-2009-problemas-recorrentes-no-motor-e-arrependimento-na-compra_VvLxUJT3ax94CgHB/
"Garantia Total de 03 anos, mas não é!","Levei meu veículo à concessionária Comeri, onde já adquiri dois veículos TCross, meu carro atual é ano 2023 e tem garantia de 03 anos total conforme me informado em outras compras na concessionária, este é o meu 3 TCross e ainda está na garantia total de fábrica, ao deixar meu carro na concessionária e reclamar de um barulho, a concessionária me informou que o problema pode ser, veja bem, pode ser, a caixa de direção e possivelmente a coluna de direção, porém foi um diagnóstico especulativo, pois os mesmos não desmontaram as peca para ter a certeza, e como o carro está na garantia foi solicitado a fábrica a substituição das peças, mas a fábrica alegou desgaste natural, pois meu veículo está com 106.000 km, portanto a garantia não cobre o desgaste natural, mas eles não tem certeza pois não desmontaram, mas minha surpresa e decepção foi que o veículo está dentro da garantia total de 03 anos conforme o que me foi dito no ato da compra, não interessa a kilometragem do veículo ou melhor, quer dizer que antes de vencer a garantia total o carro apresentou o defeito e não foi autorizado, pelo que entendo a garantia é total de 03 anos motor, câmbio e mecânica, mas a Volkswagen negou o serviço e a garantia, estou bem decepcionado com a marca e olha que sou um cliente fiel, já tive Amarok, 03 TCross e quando preciso e tenho o direito a garantia a fábrica negou, estou fazendo aqui essa reclamação e também irei ao PROCON para procurar meus direitos, afinal garantia total de 03 anos são garantia de três anos e se as peças tiveram um desgaste natural, significa que menos de 03 anos a peça apresenta defeito, deveria ser trocada, afinal você compra um veículo para andar, viajar, trabalhar, passear e isso independe da kilometragem do veículo. É decepcionante uma empresa como a Volkswagen se opor a troca alegando desgaste natural, sendo que nem desmontaram as peças, mas se está na garantia deveria prosseguir com a garantia e trocar.",SP,Santos,ANSWERED,2025-10-28T12:16:00,https://www.reclameaqui.com.br/volkswagen/garantia-total-de-03-anos-mas-nao-e_iBOU11a0wSubNGun/
"Cobrança abusiva e recusa de reparo em garantia pela Original Guarulhos com perda indevida da garantia, sem respaldo da Volkswagen.","Tive um sinistro de uma saveiro VolksWagen em garantia e a Original Guarulhos cobrou 17% acima do valor de mercado para fazer o reparo, não bastasse a cobrança muito acima do valor de mercado ainda nos informou que se fizermos em outro local iremos perder a garantia. Ok! No entanto, o sinistro atingiu somente funilaria e nos informaram que perderemos também a garantia de motor e câmbio. Onde é plausível perder garantia de motor e câmbio de um veículo que não teve essa parte afetada? E ainda, que somente não será feito o reparo na oficina da Original devido ao valor ABUSIVO cobrado pela mesma.<br />O pior de tudo é que ao entrar em contato via telefone com a fabricante VOLKSWAGEN, fui informada que sequer irão abrir a reclamação porque a concessionária Original tem total autonomia e está correta em seu posicionamento e seu orçamento, ou seja, o fabricante não dá qualquer respaldo ao cliente final! O mais interessante é que ao abrir o protocolo no site o posicionamento da VOLKS havia sido ao menos educado, enquanto que por telefone, com a atendente *****, a mesma ficou apenas repetindo respostas padrão e se RECUSOU a abrir a minha reclamação. Se o fabricante se RECUSA a ouvir a reclamação do cliente, onde iremos parar? Protocolo de atendimento via telefone: *****. Protocolo de reclamação aberto via site: *****<br />",SP,Guarulhos,PENDING,2025-10-28T11:27:47,https://www.reclameaqui.com.br/volkswagen/cobranca-abusiva-e-recusa-de-reparo-em-garantia-pela-original-guarulhos-com-perda-indevida-da-garantia-sem-respaldo-da-volkswagen_TmIG_x0c2xrNQT0n/
Defeito reincidente em Volkswagen Polo zero km com menos de um mês de uso: exijo a troca imediata!!,"Adquiri um Volkswagen Polo Sense TSI AT 116HP, zero quilômetro, modelo 2025/2026, no dia 20 de setembro de 2025, entregue pela Brasal Veículos Taguatinga (Brasília) em 25 de setembro de 2025.<br />Em menos de uma semana de uso, o carro começou a apresentar falhas no sistema de controle de emissões de poluentes, e desde então já retornou várias vezes à concessionária, sem qualquer solução definitiva.<br /><br />Segue o histórico das idas e vindas à oficina da Brasal:<br /><br /> 29/09/2025: luz de alerta do sistema de emissão de poluentes acesa. Diagnóstico feito disseram que poderia ser combustível adulterado. Luz apagada, sem troca de peça.<br /> 02/10/2025: luz acendeu novamente.<br /> 06/10/2025: novo retorno à concessionária para o mesmo procedimento.<br /> 10/10/2025: o defeito reapareceu, mesmo após abastecimento em outro posto. Além disso, o carro começou a emitir um barulho alto, semelhante a uma vibração metálica após desligado, o que inclusive foi confirmado pelo mecânico da empresa como algo anormal.<br /> 14/10/2025: deixei o carro na concessionária para análise mais detalhada.<br /> 17/10/2025: entrega do carro com a informação de que o problema havia sido solucionado.<br /> 20/10/2025: o mesmo defeito retornou, junto com o barulho e o carro foi deixado mais uma vez na concessionária.<br /><br />Nesse último retorno, relatei também outros problemas observados no sistema eletrônico e de conectividade do veículo: o botão de recirculação do ar-condicionado estava acendendo sozinho e o celular parou de se conectar automaticamente à central multimídia.<br /><br />Diante de tudo isso, solicitei a troca do veículo, pois é inadmissível que um carro zero km, comprado diretamente de uma concessionária autorizada, apresente tantos defeitos em menos de um mês de uso. A resposta da concessionária foi de que ainda não estamos em um cenário que justifique a troca do veículo e a substituição só se aplica quando fica comprovado que o defeito não tem solução palavras da própria gerente.<br /><br />Entretanto, o Código de Defesa do Consumidor (art. 18 da Lei n 8.078/90) é claro: em casos de produto novo com defeito reincidente, o consumidor não é obrigado a aguardar novos reparos, podendo exigir de imediato a substituição do bem ou a devolução do valor pago.<br /><br />Além disso, a concessionária já teve várias oportunidades para solucionar o problema. Hoje, dia 28 de outubro, ainda não tive um posicionamento sobre qual o diagnóstico do carro e não há previsão de quando ficará pronto.<br /><br />Não comprei um carro novo, zero km, para viver dentro da oficina, sem saber ao certo qual o problema que ele tem, quando na verdade não deveria apresentar problema algum! O mínimo que a empresa Brasal e a Volkswagen devem fazer é reconhecer que o carro veio com um defeito de fábrica e eu, como consumidora, tenho o direito de receber um veículo em perfeitas condições, como se espera de um produto novo!!<br /><br />Exijo respeito, agilidade e a substituição imediata do veículo, conforme prevê a legislação de defesa do consumidor!!",DF,Brasília,PENDING,2025-10-28T11:21:55,https://www.reclameaqui.com.br/volkswagen/defeito-reincidente-em-volkswagen-polo-zero-km-com-menos-de-um-mes-de-uso-exijo-a-troca-imediata_KGbrxjhkfjGgya_9/
Recall da Volkswagen: Dificuldade para agendar serviço nas concessionárias.,"Insatisfação à Volkswagen, mais uma vez a montadora lança um novo recall no meu veículo e ao entrar em contato com as concessionárias locais do veículo para agendamento, nenhuma se quer tem vagas disponíveis para realização do serviço o que me impossibilita de realizar quiser transferência do mesmo. Poderia em ajudar com a situação?",SP,Bragança Paulista,PENDING,2025-10-28T11:02:40,https://www.reclameaqui.com.br/volkswagen/recall-da-volkswagen-dificuldade-para-agendar-servico-nas-concessionarias_xmX5gIMcDMX-X9v9/
Nivus 2021 com tranco ao engatar &#39;D&#39; - Defeito não resolvido e falta de suporte da montadora,"Possuo um nivus 2021 no qual tirei 0km da concessionária, sou único dono, fiz todas as revisões na mesma e sou um cliente fiel da marca, por se tratar de um uso urbano do veículo e sem nenhum tipo de avaria, há algum tempo atrás percebi um leve tranco quando engatava o D e tirava o pé do freio, o carro dava um solavanco para frente que cada dia que passasse ficava mais intenso, daí eu levei na concessionária Maracar para buscar a solução do problema e foi diagnosticado que a peça com defeito seria o semi-eixo e foi passado um orçamento no valor de 4.160,00 para a substituição do mesmo, quando a peça chegou a concessionária para ser feita a troca, o mecânico relatou que não estava conseguindo efetuar a troca porque o antigo semi-eixo estava preso no câmbio, e, para conseguir seria necessário retirar o câmbio e então realizar a troca dó semi-eixo para esse serviço de remoção do câmbio foi me passado um valor de 1.360,00. Autorizei a substituição e ao finalizar, foi relatado novamente que o problema não teria sido resolvido e que seria o câmbio automático com defeito, liguei para a central de atendimento da Montadora VW em busca de uma solução ou uma cortesia da peça danificada, já que foi gasto mais de 5.500,00 e o problema não foi resolvido e eles simplesmente não conseguiram me dar uma posição ou resolver o problema me ajudando com a cortesia. Achei uma falta de respeito da montadora com o cliente!!<br />E um falta de suporte da empresa!!",SE,Aracaju,PENDING,2025-10-28T11:01:49,https://www.reclameaqui.com.br/volkswagen/nivus-2021-com-tranco-ao-engatar-d-defeito-nao-resolvido-e-falta-de-suporte-da-montadora_axiKhxsViHfMgixq/
Dados incorretos e incompletos das revisões no aplicativo Meu VW,"Estou com problemas com os lançamentos das revisões no aplicativo Meu VW. <br />Sou proprietário de um VW TAOS HIGHLINE 2022, onde realizei a Quinta Revisão na Concessionária Movel na cidade de Vitória da Conquista/BA. Revisão realizada no dia 29/05/25 aos 33.817 Km, sendo realizado todos os serviços solicitados pela VW. Mesmos assim, foi lançado no app Meu VW os dados da revisão com a informação de serviço incompleto( destacado em vermelho ). E também foi lançando no app Meu VW, de forma incorreta, a Sexta Revisão( data de 30/05/25 aos 33.817 Km ) que nunca aconteceu. Já realizei várias reclamações pelo app Meu VW e também pela Concessionária Movel, porém o problema nunca é resolvido. Última reclamação realizada na Concessionária Movel, no dia 22/10/25( Chamado #***** ).<br />Estou vendendo o veículo, mas esses erros referentes as revisões estão prejudicando as negociações, pois os possíveis compradores ao verificar os serviços no app Meu VW, questionam as informações incorretas a respeito das revisões realizadas, e desistem de negociar a compra do veículo. <br />Em anexo seguem as fotos que comprovam os problemas relatados. Solicito a VW para corrigir as informações do app Meu VW, em carater de URGÊNCIA, pois esses erros estão prejudicando as negociações de venda do veiculo.<br />Aguardo resposta. Obrigado.",BA,Vitória da Conquista,PENDING,2025-10-28T10:20:40,https://www.reclameaqui.com.br/volkswagen/dados-incorretos-e-incompletos-das-revisoes-no-aplicativo-meu-vw_5_A0YRDxeUNMF2iS/
Demora na manutenção do veículo por falta de peças na concessionária (5 meses),"Levei o meu veículo pra efetuar manutenção no freios, Faz 5 meses que o carro está parado na concessionária, estou alegando que não tem peças para finalizar o serviço. Sendo que o carro é novo e tem que existir peça no mercado por lei",SP,São Paulo,PENDING,2025-10-28T09:57:25,https://www.reclameaqui.com.br/volkswagen/demora-na-manutencao-do-veiculo-por-falta-de-pecas-na-concessionaria-5-meses_g1ejYkPhjlHAivuk/
"Arrependimento na compra de veículo VW devido a desconforto, suspensão inadequada e problemas de conectividade","Comprei novamente um VW, porem o carro e muito desconfortável começando por sua suspenção, que parece que esta tudo solto quando passa por um relevo no asfalto mais severo, todo acabamento do veiculo em plástico e o console do veiculo não tem atrativos, na verdade nem o encosto do braço do motorista, sendo que a função VW auto não faz espelhamento do celular, e o pendrive quando liga novamente o carro precisa tirar e colocar novamente, meu carro esta com 5k de rodagem, gostaria de devolver o veiculo e comprar outra marca, me arrependo da compra, se vc deseja um carro para melhor estrutura compre outra marca, não aconselho *VW.<br />Se fosse possível devolver o veiculo eu ja teria feito, me arrependo muito dessa compra.",AM,Manaus,PENDING,2025-10-28T08:50:06,https://www.reclameaqui.com.br/volkswagen/arrependimento-na-compra-de-veiculo-vw-devido-a-desconforto-suspensao-inadequada-e-problemas-de-conectividade_ADKjhWOw_ie5f7RY/
